{
  "schema_version": 1,
  "valid": true,
  "code": "VALID",
  "checked_at": 1800144000,
  "license_id": "LIC-TEST-0001",
  "installation_id": "11111111-1111-4111-8111-111111111111",
  "sequence": 1,
  "lease_valid_until": 1800748800,
  "entitlement_expires_at": 1831680000,
  "features": [
    "messaging",
    "transcoding"
  ],
  "lease_digest": "ff12c19326a61bfc5ab135ef593c71b796115ec5e190d6b4508b5662262a359d"
}
